<?xml version="1.0" encoding="utf-8"?>
<!--
	Licensed to the Apache Software Foundation (ASF) under one
	or more contributor license agreements.  See the NOTICE file
	distributed with this work for additional information
	regarding copyright ownership.  The ASF licenses this file
	to you under the Apache License, Version 2.0 (the
	"License"); you may not use this file except in compliance
	with the License.  You may obtain a copy of the License at

	https://www.apache.org/licenses/LICENSE-2.0

	Unless required by applicable law or agreed to in writing,
	software distributed under the License is distributed on an
	"AS IS" BASIS, WITHOUT WARRANTIES OR CONDITIONS OF ANY
	KIND, either express or implied.  See the License for the
	specific language governing permissions and limitations
	under the License.
-->
<data-map xmlns="http://cayenne.apache.org/schema/10/modelMap"
          xmlns:xsi="http://www.w3.org/2001/XMLSchema-instance"
          xsi:schemaLocation="http://cayenne.apache.org/schema/10/modelMap http://cayenne.apache.org/schema/10/modelMap.xsd"
          project-version="10">
    <property name="defaultSchema" value="SCHEMA_01"/>
    <db-entity name="PARENT" schema="SCHEMA_01">
        <db-attribute name="COL2" type="CHAR" length="25"/>
        <db-attribute name="COL3" type="DECIMAL" length="10" scale="2"/>
        <db-attribute name="ID" type="INTEGER" isPrimaryKey="true" isMandatory="true" length="10"/>
    </db-entity>
    <obj-entity name="Parent" className="Parent" dbEntityName="PARENT">
        <obj-attribute name="col2" type="java.lang.String" db-attribute-path="COL2"/>
        <info:property xmlns:info="http://cayenne.apache.org/schema/10/info" name="comment" value="test"/>
    </obj-entity>
</data-map>
