<?xml version="1.0" encoding="utf-8"?>
<data-map xmlns="http://cayenne.apache.org/schema/7/modelMap"
	 xmlns:xsi="http://www.w3.org/2001/XMLSchema-instance"
	 xsi:schemaLocation="http://cayenne.apache.org/schema/7/modelMap http://cayenne.apache.org/schema/7/modelMap.xsd"
	 project-version="7">
	<property name="defaultPackage" value="org.apache.cayenne.java8.db"/>
	<db-entity name="LOCAL_DATE_TEST">
		<db-attribute name="Date" type="DATE"/>
		<db-attribute name="ID" type="INTEGER" isPrimaryKey="true" isMandatory="true"/>
	</db-entity>
	<db-entity name="LOCAL_DATETIME_TEST">
		<db-attribute name="ID" type="INTEGER" isPrimaryKey="true" isMandatory="true"/>
		<db-attribute name="Timestamp" type="TIMESTAMP"/>
	</db-entity>
	<db-entity name="LOCAL_TIME_TEST">
		<db-attribute name="ID" type="INTEGER" isPrimaryKey="true" isMandatory="true"/>
		<db-attribute name="Time" type="TIME"/>
	</db-entity>
	<obj-entity name="LocalDateTest" className="org.apache.cayenne.java8.db.LocalDateTestEntity" dbEntityName="LOCAL_DATE_TEST">
		<obj-attribute name="date" type="java.time.LocalDate" db-attribute-path="Date"/>
	</obj-entity>
	<obj-entity name="LocalDateTimeTest" className="org.apache.cayenne.java8.db.LocalDateTimeTestEntity" dbEntityName="LOCAL_DATETIME_TEST">
		<obj-attribute name="timestamp" type="java.time.LocalDateTime" db-attribute-path="Timestamp"/>
	</obj-entity>
	<obj-entity name="LocalTimeTest" className="org.apache.cayenne.java8.db.LocalTimeTestEntity" dbEntityName="LOCAL_TIME_TEST">
		<obj-attribute name="time" type="java.time.LocalTime" db-attribute-path="Time"/>
	</obj-entity>
</data-map>
