<?xml version="1.0" encoding="utf-8"?>
<data-map xmlns="http://cayenne.apache.org/schema/8/modelMap"
          xmlns:xsi="http://www.w3.org/2001/XMLSchema-instance"
          xsi:schemaLocation="http://cayenne.apache.org/schema/8/modelMap http://cayenne.apache.org/schema/8/modelMap.xsd"
          project-version="8">
    <property name="defaultPackage" value="org.apache.cayenne.testdo.generated"/>
    <property name="defaultSuperclass" value="org.apache.cayenne.CayenneDataObject"/>
    <property name="clientSupported" value="true"/>
    <property name="defaultClientPackage" value="test.client"/>
    <property name="defaultClientSuperclass" value="org.apache.cayenne.PersistentObject"/>
    <db-entity name="GENERATED_COLUMN_COMP_KEY">
        <db-attribute name="AUTO_PK" type="INTEGER" isPrimaryKey="true" isMandatory="true"/>
        <db-attribute name="GENERATED_COLUMN" type="INTEGER" isPrimaryKey="true" isGenerated="true" isMandatory="true"/>
        <db-attribute name="NAME" type="VARCHAR" length="100"/>
        <db-attribute name="PROPAGATED_PK" type="INTEGER" isPrimaryKey="true" isMandatory="true"/>
    </db-entity>
    <db-entity name="GENERATED_COLUMN_COMP_M">
        <db-attribute name="ID" type="INTEGER" isPrimaryKey="true" isMandatory="true"/>
        <db-attribute name="NAME" type="VARCHAR" length="100"/>
    </db-entity>
    <db-entity name="GENERATED_COLUMN_DEP">
        <db-attribute name="GENERATED_COLUMN_FK" type="INTEGER" isPrimaryKey="true" isMandatory="true"/>
        <db-attribute name="NAME" type="VARCHAR" length="100"/>
    </db-entity>
    <db-entity name="GENERATED_COLUMN_TEST">
        <db-attribute name="GENERATED_COLUMN" type="INTEGER" isPrimaryKey="true" isGenerated="true" isMandatory="true"/>
        <db-attribute name="NAME" type="VARCHAR" length="250"/>
    </db-entity>
    <db-entity name="GENERATED_COLUMN_TEST2">
        <db-attribute name="GENERATED_COLUMN" type="INTEGER" isPrimaryKey="true" isGenerated="true" isMandatory="true"/>
        <db-attribute name="NAME" type="VARCHAR" length="100"/>
    </db-entity>
    <db-entity name="GENERATED_F1">
        <db-attribute name="ID" type="INTEGER" isPrimaryKey="true" isMandatory="true"/>
    </db-entity>
    <db-entity name="GENERATED_F2">
        <db-attribute name="ID" type="INTEGER" isPrimaryKey="true" isMandatory="true"/>
    </db-entity>
    <db-entity name="GENERATED_JOIN">
        <db-attribute name="ID" type="INTEGER" isPrimaryKey="true" isGenerated="true" isMandatory="true"/>
        <db-attribute name="ID1" type="INTEGER"/>
        <db-attribute name="ID2" type="INTEGER"/>
    </db-entity>
    <obj-entity name="GeneratedColumnCompKey" className="org.apache.cayenne.testdo.generated.GeneratedColumnCompKey" dbEntityName="GENERATED_COLUMN_COMP_KEY">
        <obj-attribute name="name" type="java.lang.String" db-attribute-path="NAME"/>
    </obj-entity>
    <obj-entity name="GeneratedColumnCompMaster" className="org.apache.cayenne.testdo.generated.GeneratedColumnCompMaster" dbEntityName="GENERATED_COLUMN_COMP_M">
        <obj-attribute name="name" type="java.lang.String" db-attribute-path="NAME"/>
    </obj-entity>
    <obj-entity name="GeneratedColumnDep" className="org.apache.cayenne.testdo.generated.GeneratedColumnDep" dbEntityName="GENERATED_COLUMN_DEP">
        <obj-attribute name="name" type="java.lang.String" db-attribute-path="NAME"/>
    </obj-entity>
    <obj-entity name="GeneratedColumnTest2" className="org.apache.cayenne.testdo.generated.GeneratedColumnTest2" dbEntityName="GENERATED_COLUMN_TEST2">
        <obj-attribute name="name" type="java.lang.String" db-attribute-path="NAME"/>
    </obj-entity>
    <obj-entity name="GeneratedColumnTestEntity" className="org.apache.cayenne.testdo.generated.GeneratedColumnTestEntity" dbEntityName="GENERATED_COLUMN_TEST">
        <obj-attribute name="name" type="java.lang.String" db-attribute-path="NAME"/>
    </obj-entity>
    <obj-entity name="GeneratedF1" className="org.apache.cayenne.testdo.generated.GeneratedF1" clientClassName="test.client.GeneratedF1" dbEntityName="GENERATED_F1" superClassName="org.apache.cayenne.CayenneDataObject" clientSuperClassName="org.apache.cayenne.PersistentObject">
    </obj-entity>
    <obj-entity name="GeneratedF2" className="org.apache.cayenne.testdo.generated.GeneratedF2" clientClassName="test.client.GeneratedF2" dbEntityName="GENERATED_F2" superClassName="org.apache.cayenne.CayenneDataObject" clientSuperClassName="org.apache.cayenne.PersistentObject">
    </obj-entity>
    <db-relationship name="toMaster" source="GENERATED_COLUMN_COMP_KEY" target="GENERATED_COLUMN_COMP_M" toMany="false">
        <db-attribute-pair source="PROPAGATED_PK" target="ID"/>
    </db-relationship>
    <db-relationship name="toDetail" source="GENERATED_COLUMN_COMP_M" target="GENERATED_COLUMN_COMP_KEY" toDependentPK="true" toMany="true">
        <db-attribute-pair source="ID" target="PROPAGATED_PK"/>
    </db-relationship>
    <db-relationship name="toMaster" source="GENERATED_COLUMN_DEP" target="GENERATED_COLUMN_TEST" toMany="false">
        <db-attribute-pair source="GENERATED_COLUMN_FK" target="GENERATED_COLUMN"/>
    </db-relationship>
    <db-relationship name="toDep" source="GENERATED_COLUMN_TEST" target="GENERATED_COLUMN_DEP" toDependentPK="true" toMany="false">
        <db-attribute-pair source="GENERATED_COLUMN" target="GENERATED_COLUMN_FK"/>
    </db-relationship>
    <db-relationship name="join" source="GENERATED_F1" target="GENERATED_JOIN" toMany="true">
        <db-attribute-pair source="ID" target="ID1"/>
    </db-relationship>
    <db-relationship name="join" source="GENERATED_F2" target="GENERATED_JOIN" toMany="true">
        <db-attribute-pair source="ID" target="ID2"/>
    </db-relationship>
    <db-relationship name="f1" source="GENERATED_JOIN" target="GENERATED_F1" toMany="false">
        <db-attribute-pair source="ID1" target="ID"/>
    </db-relationship>
    <db-relationship name="f2" source="GENERATED_JOIN" target="GENERATED_F2" toMany="false">
        <db-attribute-pair source="ID2" target="ID"/>
    </db-relationship>
    <obj-relationship name="toMaster" source="GeneratedColumnCompKey" target="GeneratedColumnCompMaster" db-relationship-path="toMaster"/>
    <obj-relationship name="toDetail" source="GeneratedColumnCompMaster" target="GeneratedColumnCompKey" db-relationship-path="toDetail"/>
    <obj-relationship name="toMaster" source="GeneratedColumnDep" target="GeneratedColumnTestEntity" db-relationship-path="toMaster"/>
    <obj-relationship name="toDep" source="GeneratedColumnTestEntity" target="GeneratedColumnDep" db-relationship-path="toDep"/>
    <obj-relationship name="f2" source="GeneratedF1" target="GeneratedF2" deleteRule="Nullify" db-relationship-path="join.f2"/>
    <obj-relationship name="f1" source="GeneratedF2" target="GeneratedF1" deleteRule="Nullify" db-relationship-path="join.f1"/>
</data-map>
